,Unnamed: 0,responsibility,conditions,requirement,description,name,city,salary_from,salary_to,employer,published_at,experience,employment,schedule,key_skills
894,894,"поддержка и администрирование it инфраструктуры компании; обеспечение бесперебойной работы сети и персональных компьютеров и системы видео наблюдения; установка и настройка ос linux/ms windows, пользовательских и сетевых программ; обеспечение сетевой безопасности; организация доступа к локальной и глобальной сетям. обеспечение почтового обслуживания; сборка, установка и поддержка работоспособности пк и других периферийных устройств на рабочих местах сотрудников компании; закупка комплектующих, по, компьютерной техники. взаимодействие с поставщиками услуг; техническая поддержка пользователей.","официальное оформление по тк рф; уютный офис в 15 минутах ходьбы от ст. м. навская, развозка от ст. м. кировский завод до бизнес-центра; график работы: пн - пт с 10.00 до 19.00; дмс после испытательного срока; работа в молодом, дружном, профессиональном коллективе, интересная корпоративная жизнь.","знание ос windows и linux на уровне администратора; знание сервисов dhcp, dns; знание аппаратной части пк, опыт его ремонта и диагностики; умение прокладывать и настраивать офисные сети; умение самостоятельно выявлять и устранять возникающие неполадки; ответственность, доброжелательность, вежливость. официальное оформление по тк рф; уютный офис в 15 минутах ходьбы от ст. м. навская, развозка от ст. м. кировский завод до бизнес-центра; график работы: пн - пт с 10.00 до 19.00; дмс после испытательного срока; работа в молодом, дружном, профессиональном коллективе, интересная корпоративная жизнь.","поддержка и администрирование it инфраструктуры компании; обеспечение бесперебойной работы сети и персональных компьютеров и системы видео наблюдения; установка и настройка ос linux/ms windows, пользовательских и сетевых программ; обеспечение сетевой безопасности; организация доступа к локальной и глобальной сетям. обеспечение почтового обслуживания; сборка, установка и поддержка работоспособности пк и других периферийных устройств на рабочих местах сотрудников компании; закупка комплектующих, по, компьютерной техники. взаимодействие с поставщиками услуг; техническая поддержка пользователей. знание ос windows и linux на уровне администратора; знание сервисов dhcp, dns; знание аппаратной части пк, опыт его ремонта и диагностики; умение прокладывать и настраивать офисные сети; умение самостоятельно выявлять и устранять возникающие неполадки; ответственность, доброжелательность, вежливость. официальное оформление по тк рф; уютный офис в 15 минутах ходьбы от ст. м. навская, развозка от ст. м. кировский завод до бизнес-центра; график работы: пн - пт с 10.00 до 19.00; дмс после испытательного срока; работа в молодом, дружном, профессиональном коллективе, интересная корпоративная жизнь.",системныйадминистратор,Санкт-Петербург,30000.0,30000.0,RU-CENTER Group,2019-09-11T17:23:22+0300,between1And3,full,fullDay,Linux|Windows 7|Администрирование сетевого оборудования|Техническое обслуживание|Офисная техника|Ремонт ПК|Настройка ПО|Настройка ПК|Администрирование серверов Linux|Администрирование серверов|Сборка ПК
962,962,подготовка рабочих мест сотрудников; установка и настройка программного обеспечения; решение проблемы с различным офисным оборудованием; поддержка работы проводной и беспроводной сети; информационная поддержка пользователей в том числе удаленных;,офис м. василеостровская; оформление согласно тк рф работа в динамично развивающейся компании;,хорошее знание ос windows и офисных пакетов; готовность и желание работать с macos/linux/unix; базовые знания о железе и по представление о работе сетевого стека; базовые знания по стеку протоколов tcp/ip и модели osi; умение самостоятельно решать проблемы. офис м. василеостровская; оформление согласно тк рф работа в динамично развивающейся компании;,подготовка рабочих мест сотрудников; установка и настройка программного обеспечения; решение проблемы с различным офисным оборудованием; поддержка работы проводной и беспроводной сети; информационная поддержка пользователей в том числе удаленных; хорошее знание ос windows и офисных пакетов; готовность и желание работать с macos/linux/unix; базовые знания о железе и по представление о работе сетевого стека; базовые знания по стеку протоколов tcp/ip и модели osi; умение самостоятельно решать проблемы. офис м. василеостровская; оформление согласно тк рф работа в динамично развивающейся компании;,помощниксистемногоадминистратора,Санкт-Петербург,30000.0,30000.0,ИнфоСервис,2019-10-07T20:02:23+0300,between1And3,full,fullDay,
1241,1241,,,,"«энергосбытовая компания «восток» (ао «эк «восток») успешно работает в энергосбытовом секторе уже более пятнадцати лет и в настоящее время поставляет электроэнергию клиентам на территории десяти субъектов российской федерации. каждому сотруднику нашей компании предоставлена реальная возможность реализовать свой потенциал, получить ценный опыт работы, повысить свой статус в успешной команде профессионалов. чем предстоит заниматься? техническая поддержка, консультирование, обучение пользователей. администрирование и настройка прав доступа к документам, справочников системы. оформление обращений в тех. поддержку подрядчика. сопровождение и доработка, с помощью встроенных средств, системы электронного документооборота wss docs. мониторинг работоспособности системы, сбор и анализ логов (windows server, iis, ms sql), оперативное устранение инцидентов в зоне своей ответственности. что мы ожидаем от будущего кандидата? коммуникабельность. способность в короткие сроки изучить новую информационную систему. базовые знание субд ms sql: запросы на языке t-sql, анализ производительности, администрирование. знание iis: администрирование, анализ производительности. грамотная письменная и устная речь. дополнительным преимуществом будет: опыт администрирования или внедрения систем документооборота. знание языков программирования: с#, javascript знание платформы microsoft sharepoint. мы постарались создать все условия для продуктивной и интересной работы: официальное трудоустройство согласно тк рф; стабильный, а главное полностью официальный доход; реальный карьерный рост в крупнейшей компании; атмосфера взаимопомощи и дружелюбия; работа в команде профессионалов в атмосфере взаимопомощи и поддержки; классическая пятидневка с фиксированными выходными; график работы: с 8-00 до 17-00; обучение за счет предприятия. множество интересных задач, в решении которых вы можете принять полноправное участие. рабочее место харьковская 75/1 а также в качестве бонуса: забота о здоровье: соц. пакет и бесплатные мед. обследования; подарки в честь значимых событий в жизни сотрудников: рождение ребенка, свадьба, подарки детям на новый год. если вы ищите стабильную и интересную работу, то будем рады вашим резюме!",специалисттех.поддержкисистемыэлектронногодокументооборота(сэд),Тюмень,30000.0,30000.0,"Восток, Энергосбытовая компания",2019-10-01T21:22:45+0300,noExperience,full,fullDay,
446,446,видео съемка сюжетных роликов для youtube детской тематики. монтаж отснятых видеороликов (монтаж с футажами),"график работы: пт суб, вос (можно изменить) съемки 3 раза в неделю на территории работодателя, съемки занимают около 2х часов. монтаж удаленно.","уверенное владение adobe premiere pro желательно наличие профессиональной техники для видеосъемки обязателен опыт видеосъемки и монтажа профильное образование будет преимуществом уверенное владение adobe premiere pro. план: 13 роликов по 5 минут в месяц график работы: пт суб, вос (можно изменить) съемки 3 раза в неделю на территории работодателя, съемки занимают около 2х часов. монтаж удаленно.","требуется видеооператор - видеомонтажер роликов для youtube видео съемка сюжетных роликов для youtube детской тематики. монтаж отснятых видеороликов (монтаж с футажами) уверенное владение adobe premiere pro желательно наличие профессиональной техники для видеосъемки обязателен опыт видеосъемки и монтажа профильное образование будет преимуществом уверенное владение adobe premiere pro. план: 13 роликов по 5 минут в месяц график работы: пт суб, вос (можно изменить) съемки 3 раза в неделю на территории работодателя, съемки занимают около 2х часов. монтаж удаленно.",видеооператорвидеомонтажер,Санкт-Петербург,,30000.0,Воркинс,2019-10-09T22:19:02+0300,noExperience,full,fullDay,Видеосъемка|Видеомонтаж|Adobe Premier Pro|Обработка видео|Adobe Premier
461,461,,крупные и интересные проекты для в2в сектора; гибкое начало рабочего дня; уютный офис в 5-ти минутах от ст.м. озерки со своей парковкой; дмс; обучение.,знание ms sql server; готовность обучаться в рабочем процессе; желание вырасти классным разработчиком. крупные и интересные проекты для в2в сектора; гибкое начало рабочего дня; уютный офис в 5-ти минутах от ст.м. озерки со своей парковкой; дмс; обучение.,"наш клиент - компания, занимающаяся разработкой и внедрением систем для предприятий розничной, оптовой торговли и дистрибуции, приглашает к себе в команду sql разработчика примерные задачи: участие в разработке хранилищ данных, аналитических моделей на основе ms analysis services (olap, tabular); разработка отчетности. знание ms sql server; готовность обучаться в рабочем процессе; желание вырасти классным разработчиком. крупные и интересные проекты для в2в сектора; гибкое начало рабочего дня; уютный офис в 5-ти минутах от ст.м. озерки со своей парковкой; дмс; обучение.",juniorsqlразработчик,Санкт-Петербург,,30000.0,HR-PROFI,2019-10-04T11:29:43+0300,noExperience,full,flexible,
904,904,,"трудоустройство по тк рф участие в интересных проектах обеспечение всей необходимой техникой комфортный офис напротив метро петроградская кухня, завтраки, кофе\чай\сладости\фрукты. рост и бонусы молодой и дружелюбный коллектив /будем благодарны за подробную информацию о себе в отклике/","уверенные теоретические знания железа и софта; понимание всех классов компьютерных сетей; знание командной строки и архитектуры linix (debian, freebsd или другой); понимание, что такое модель osi; пунктуальность, исполнительность, желание развиваться и выполнять свой круг задач;","компания buidl - это # современные стек технологии; # интересная предметная область, финансы и блокчейн; # современные архитектурные подходы; # гибкие условия по графику, нет лишнего формализма; свободный подход в общении в коллективе; # молодая и дружная команда; # разработка технически сложных систем. # разнообразные направления проектов от более близких к “железу” до высоконагруженных и высокодоступных финансовых и информационных сервисов. приглашаем на стажировку сисадмина инженера с отличным знанием теории! задачи: сборка пк, серверов; прошивка оборудования; установка и настройка ос; создание и настройка сетей; работа с web-сервисами; уверенные теоретические знания железа и софта; понимание всех классов компьютерных сетей; знание командной строки и архитектуры linix (debian, freebsd или другой); понимание, что такое модель osi; пунктуальность, исполнительность, желание развиваться и выполнять свой круг задач; будет плюсом: стойкое стремление развиваться в этой области - прикладного системного администрирования; знание с какой стороны браться за паяльник - иногда требуется выполнить мелкую пайку; трудоустройство по тк рф участие в интересных проектах обеспечение всей необходимой техникой комфортный офис напротив метро петроградская кухня, завтраки, кофе\чай\сладости\фрукты. рост и бонусы молодой и дружелюбный коллектив /будем благодарны за подробную информацию о себе в отклике/",системныйадминистратор(стажер),Санкт-Петербург,,30000.0,BUIDL LLC,2019-10-10T12:30:51+0300,noExperience,full,flexible,Linux|Сетевое оборудование|Nginx|Сборка ПК|TCP/IP|Настройка ПО|Настройка VPS/VDS серверов|Настройка сетевых подключений|Настройка серверов|Ubuntu Server
765,765,,официальное оформление; офис на новочеркасской (10 минут пешком); кофе / чай / отличные бытовые условия.,"базовые знания в области seo; базовые знания html в объеме, достаточном для верстки текстов; хорошие знания word / excel; грамотный русский язык.","в веб-студию binardi требуется помощник seo-специалиста . мы готовы рассматривать кандидатов без опыта / с небольшим опытом, также готовы рассмотреть вариант удаленной работы. базовые знания в области seo; базовые знания html в объеме, достаточном для верстки текстов; хорошие знания word / excel; грамотный русский язык. задачи: работа с семантикой сайта; внутренняя оптимизация; написание текстов / заказ текстов и их последующая проверка и публикация; внутренняя отчетность. официальное оформление; офис на новочеркасской (10 минут пешком); кофе / чай / отличные бытовые условия.",помощникseo-специалиста,Санкт-Петербург,20000.0,32000.0,Веб-студия binardi,2019-10-08T13:49:27+0300,noExperience,full,fullDay,SEO|HTML|Грамотность|Копирайтинг
1332,1332,поддержка и консультирование пользователей 1с небольшие доработки и исправления,"5 дневная рабочая неделя, устройство по тк","опыт работы в поддержке 1с знание 1с или опыт программирования и поддержки по 5 дневная рабочая неделя, устройство по тк","поддержка и консультирование пользователей 1с небольшие доработки и исправления опыт работы в поддержке 1с знание 1с или опыт программирования и поддержки по 5 дневная рабочая неделя, устройство по тк возможности: - возможность развиваться и обучаться на задачах, расти в профессиональном плане, в команде профессионалов.",специалисттехническойподдержки1:с,Тюмень,25000.0,32000.0,Автоград Центр,2019-10-08T10:18:38+0300,between1And3,full,fullDay,1С: Бухгалтерия|1С: Предприятие 8|Техническая поддержка
