,Unnamed: 0,responsibility,conditions,requirement,description,name,city,salary_from,salary_to,employer,published_at,experience,employment,schedule,key_skills
880,880,"установка wi-fi роутеров, приставок настройка клиентского оборудования прокладка кабеля от оборудования до квартиры клиента консультация клиентов отчётность","средняя оплата подключения 600-800 рублей, при выполнении 4 самых заявок в день минимальный уровень дохода составляет 28 000 в месяц, есть возможность зарабатывать больше частичная занятость в вечерние часы с 18 до 22 и в выходные дни по согласованию с руководителем (минимум 20 часов в неделю) официальное трудоустройство, белая заработная плата обучение возможность карьерного роста, в том числе, перехода на позицию сервисного инженера","желание развиваться в технической сфере (техническое образование будет вашим преимуществом) пунктуальность ответственное отношение к работе средняя оплата подключения 600-800 рублей, при выполнении 4 самых заявок в день минимальный уровень дохода составляет 28 000 в месяц, есть возможность зарабатывать больше частичная занятость в вечерние часы с 18 до 22 и в выходные дни по согласованию с руководителем (минимум 20 часов в неделю) официальное трудоустройство, белая заработная плата обучение возможность карьерного роста, в том числе, перехода на позицию сервисного инженера","ао «эр-телеком холдинг» – один из ведущих операторов информационно-коммуникационных услуг в россии, работаем с 2001 года. под брендом «дом.ru» для частных лиц мы предоставляем такие услуги,как: широкополосный доступ в интернет, цифровое тв, телефонную связь. холдинг входит в тройку крупнейших интернет-провайдеров и операторов кабельного телевидения россии! лауреат многих национальных премий, включая премию «большая цифра», «техуспех», loyalty awards russia, speed test awards. наша компания представлена в 566 населенных пунктах, у нас более 17000 сотрудников и 1500 новых клиентов каждый день! наши ценности : побеждать, ценить, радоваться, совершенствовать, отвечать за обязательства! в компании открыта позиция техник подключения установка wi-fi роутеров, приставок настройка клиентского оборудования прокладка кабеля от оборудования до квартиры клиента консультация клиентов отчётность желание развиваться в технической сфере (техническое образование будет вашим преимуществом) пунктуальность ответственное отношение к работе средняя оплата подключения 600-800 рублей, при выполнении 4 самых заявок в день минимальный уровень дохода составляет 28 000 в месяц, есть возможность зарабатывать больше частичная занятость в вечерние часы с 18 до 22 и в выходные дни по согласованию с руководителем (минимум 20 часов в неделю) официальное трудоустройство, белая заработная плата обучение возможность карьерного роста, в том числе, перехода на позицию сервисного инженера",техникподключения,Санкт-Петербург,28000.0,32000.0,ЭР-Телеком,2019-09-11T11:59:43+0300,noExperience,part,flexible,Клиентоориентированность|Точность и внимательность к деталям|Пользователь ПК|Настройка сетевых подключений
223,223,"обеспечение бесперебойной и безопасной работы офисного оборудования, сетевого доступа и программного обеспечения; обеспечение информационной безопасности и реализация комплекса мер по защите информации; взаимодействие с пользователями, принятие мер по восстановлению рабочей сети при сбоях или выходе из строя сетевого оборудования; закупка программного обеспечения и компьютерного оборудования.",,"знание операционных систем ms windows, windows server; знание основ построения и маршрутизации локально-вычислительных сетей; знание и администрирование 1с приветствуется; ответственность, активность, порядочность.","в стабильную и успешную компанию, осуществляющую управление собственной коммерческой недвижимостью, требуется системный администратор обеспечение бесперебойной и безопасной работы офисного оборудования, сетевого доступа и программного обеспечения; обеспечение информационной безопасности и реализация комплекса мер по защите информации; взаимодействие с пользователями, принятие мер по восстановлению рабочей сети при сбоях или выходе из строя сетевого оборудования; закупка программного обеспечения и компьютерного оборудования. знание операционных систем ms windows, windows server; знание основ построения и маршрутизации локально-вычислительных сетей; знание и администрирование 1с приветствуется; ответственность, активность, порядочность. мы предлагаем : оформление в соответствии с тк рф; график 5/2 с 9-00 до 18-00 (по пятницам до 17-00); офис находится в шаговой доступности от ст. м. озерки; оборудованное комфортное рабочее место; частичная оплата питания в собственном корпоративном кафе; бесплатные завтраки, компенсация транспортных расходов; полностью официальная заработная плата; возможность карьерного и финансового роста; молодой и дружный коллектив",системныйадминистратор,Санкт-Петербург,32000.0,32000.0,Группа компаний Форум,2019-10-07T17:32:22+0300,noExperience,full,fullDay,
815,815,,,желателен опыт работы с людьми на позиции администратора коммуникабельность и активность знание пк на уровне пользователя,"case place - это интернет-сервис по подбору и созданию креативных чехлов и аксессуаров для клиентов. сейчас мы строим сильную молодую и амбициозную команду, и если вы хотите стать ее частью - мы ждем вашего отклика. что вам нужно будет делать? выдавать заказы клиентам и работать с кассой звонить клиентам с напоминанием о заказе (никаких холодных продаж) помогать клиентам в переносе даты доставки или возврате/обмене желателен опыт работы с людьми на позиции администратора коммуникабельность и активность знание пк на уровне пользователя что мы можем предложить? работа в историческом центре петербурга (7-10 минут ходьбы от метро петроградская) график 2/2 с 9:00 до 21:00 своевременные выплаты 2 раза в месяц оплачиваемые отпуск и больничный бесплатные чай, кофе, фрукты и снэки корпоративные скидки дружный молодой коллектив хотите работать? просто откликнитесь и мы свяжемся с вами в течение 2х дней.",операторпунктавыдачизаказов,Санкт-Петербург,30000.0,33000.0,КЕЙС ПЛЭЙС,2019-10-09T09:54:57+0300,noExperience,full,shift,Коммуникабельность|Стрессоустойчивость|Умение работать в режиме многозадачности|Пунктуальность|Ответственность|Уверенный пользователь ПК
1258,1258,прокачивать аккаунты в wow:classic. будет предоставлена пошаговая инструкция как это делать; играть в соответствии с графиком который можно выбрать самому;,,,"компания legionfarm ищет тебя. любишь компьютерные игры? мечтал зарабатывать на этом деньги? вместе мы создадим профессию будущего - геймер . мы хотим, чтобы ты и сотни миллионов игроков по всему миру получили возможность официально и легально зарабатывать деньги играя в игры. прокачивать аккаунты в wow:classic. будет предоставлена пошаговая инструкция как это делать; играть в соответствии с графиком который можно выбрать самому; нет опыта в wow? при отсутствии опыта в игре world of warcraft мы дадим пошаговую инструкцию как быстро прокачать персонажа если нет знания английского будет достаточно воспользоваться переводчиком отсутствие опыта вы можете компенсировать использование гайдов из интернета, youtube и др. главное сообразительность занятость : удаленно, полный день. оклад сдельный от 17 000р. - 34 000р. в месяц в зависимости от скорости и навыка в прокачки; возможности карьерного роста. если ты качаешь аккаунт быстро, то сможешь работать не за фиксированную стоимость, а за процент от заказа. будешь зарабатывать не от 17 000р. а от 35 000р. в месяц;",геймер,Тюмень,17000.0,34000.0,Геймгард,2019-10-07T16:59:41+0300,noExperience,full,remote,игровая индустрия|игры|Customer Service|service provider|Boost|booster|игрок|геймер|gamer|game|player|компьютерные игры|киберспорт|гейминг|world of warcraft|wow|wow: classic|wow: bfa|mmorpg
1224,1224,"• полное сопровождение и обеспечение бесперебойной работы объекта по линии it; • закупка оборудования и расходных материалов; • блочный и мелкий ремонт, обслуживание компьютерной и телефонной сетей; • сборка и текущий блочный ремонт серверов и рабочих станций; • поддержание в актуальном состоянии исполнительной документации по it системам; • обеспечение корректного учета it оборудования.","• гарантированная своевременная заработная плата; • оформление в штат компании в соответствии с тк рф (отпуск, больничный лист); • дополнительная мотивация: бонусы по итогам годовой оценки performance management, премии за стаж работы в компании и пр.; • возможность карьерного роста; • развитая корпоративная культура: дополнительный день отпуска по случаю дня рождения, подарки по случаю рождения детей; корпоративные конкурсы и мероприятия для сотрудников и их детей; благотворительные проекты внутри компании, направленные на оказание помощи сотрудникам и членам их семей, попавшим в сложную жизненную ситуацию и пр.","• образование не ниже среднего профессионального; • администрирование: ms windows (2003,2008, xp)/ms office/1с 8.1/ms sql (поддержка)/active directory/ms exchange; • опыт прокладки сетей, настройки сетевого оборудования; • опыт настройки и обслуживания атс panasonic; • опыт ремонта и обслуживания ч/б лазерных/струйных принтеров; • опыт управления резервным копированием данных; • опыт установки и поддержки антивирусного по. • полное сопровождение и обеспечение бесперебойной работы объекта по линии it; • закупка оборудования и расходных материалов; • блочный и мелкий ремонт, обслуживание компьютерной и телефонной сетей; • сборка и текущий блочный ремонт серверов и рабочих станций; • поддержание в актуальном состоянии исполнительной документации по it системам; • обеспечение корректного учета it оборудования. • гарантированная своевременная заработная плата; • оформление в штат компании в соответствии с тк рф (отпуск, больничный лист); • дополнительная мотивация: бонусы по итогам годовой оценки performance management, премии за стаж работы в компании и пр.; • возможность карьерного роста; • развитая корпоративная культура: дополнительный день отпуска по случаю дня рождения, подарки по случаю рождения детей; корпоративные конкурсы и мероприятия для сотрудников и их детей; благотворительные проекты внутри компании, направленные на оказание помощи сотрудникам и членам их семей, попавшим в сложную жизненную ситуацию и пр.","• образование не ниже среднего профессионального; • администрирование: ms windows (2003,2008, xp)/ms office/1с 8.1/ms sql (поддержка)/active directory/ms exchange; • опыт прокладки сетей, настройки сетевого оборудования; • опыт настройки и обслуживания атс panasonic; • опыт ремонта и обслуживания ч/б лазерных/струйных принтеров; • опыт управления резервным копированием данных; • опыт установки и поддержки антивирусного по. • полное сопровождение и обеспечение бесперебойной работы объекта по линии it; • закупка оборудования и расходных материалов; • блочный и мелкий ремонт, обслуживание компьютерной и телефонной сетей; • сборка и текущий блочный ремонт серверов и рабочих станций; • поддержание в актуальном состоянии исполнительной документации по it системам; • обеспечение корректного учета it оборудования. • гарантированная своевременная заработная плата; • оформление в штат компании в соответствии с тк рф (отпуск, больничный лист); • дополнительная мотивация: бонусы по итогам годовой оценки performance management, премии за стаж работы в компании и пр.; • возможность карьерного роста; • развитая корпоративная культура: дополнительный день отпуска по случаю дня рождения, подарки по случаю рождения детей; корпоративные конкурсы и мероприятия для сотрудников и их детей; благотворительные проекты внутри компании, направленные на оказание помощи сотрудникам и членам их семей, попавшим в сложную жизненную ситуацию и пр.",специалистпоинформационнымтехнологиям,Тюмень,34000.0,34000.0,"СНС, Группа Компаний",2019-09-23T08:17:09+0300,between1And3,full,fullDay,
238,238,,"интересная и активная работа в среде знатоков сферы телекоммуникаций. возможность участия в интересных проектах и реализации профессионального опыта. возможность обучения и совершенствования своих навыков. достойная и своевременная оплата труда и возможность карьерного роста. дмс для всех сотрудников компании; офисный врач. стоматология по полису дмс на корпоративных условиях. премии за выслугу лет в компании. финансовая поддержка в значимых событиях. корпоративные праздники и подарки для сотрудников и их детей. оборудованная комната для приема пищи. возможность заниматься спортом – своя волейбольная и футбольная команды, либо возможность быть активным болельщиком. льготное изучение английского языка в офисе. возможность участвовать в корпоративном волонтерском движении.",,"круг интересных задач: отсмотр контента; заполнение карточек фильмов в базе контента; внесение выходных данных фильма, написание краткого синопсис (если информация только на иностранном языке – переводить с внешних источников); обозначение спорных сцен, присвоение возрастного рейтинга фильму в соответствии с законом; кого мы ищем: имеет высшее образование (гуманитарное); знает программ ms office, adobe; обладает хорошими знаниями англ.языка; имеет опыт работы с текстами: написание, редактирование; знание кинематографа будет преимуществом; интересная и активная работа в среде знатоков сферы телекоммуникаций. возможность участия в интересных проектах и реализации профессионального опыта. возможность обучения и совершенствования своих навыков. достойная и своевременная оплата труда и возможность карьерного роста. дмс для всех сотрудников компании; офисный врач. стоматология по полису дмс на корпоративных условиях. премии за выслугу лет в компании. финансовая поддержка в значимых событиях. корпоративные праздники и подарки для сотрудников и их детей. оборудованная комната для приема пищи. возможность заниматься спортом – своя волейбольная и футбольная команды, либо возможность быть активным болельщиком. льготное изучение английского языка в офисе. возможность участвовать в корпоративном волонтерском движении.",редакторотсмотраконтента,Санкт-Петербург,,34000.0,Триколор,2019-09-16T18:13:12+0300,between1And3,full,fullDay,
