,Unnamed: 0,responsibility,conditions,requirement,description,name,city,salary_from,salary_to,employer,published_at,experience,employment,schedule,key_skills
532,532,"⦁ вёрстка страниц для сайтов на основе psd макетов (bootstrap); ⦁ вёрстка для адаптивных и мобильных решений; ⦁ выполнение правок на сайтах (по верстке, на wp); ⦁ оптимизация кода и графики; ⦁ самостоятельная «нарезка» графических элементов из растровых и векторных исходников;","⦁ никакого общения с клиентами; ⦁ своевременные выплаты; ⦁ гибкий график; ⦁ молодой коллектив, лишенный лишних формальностей; ⦁ возможность карьерного, профессионального, личностного роста.","⦁ хорошие знания html5, css3, js(jquery как минимум), less/sass; ⦁ использование инструментов для сборки; ⦁ интерес к разработке сайтов; ⦁ верстка должна быть кроссбраузерной, адаптивной, валидной и с высокой скоростью загрузки; ⦁ обязательно наличие портфолио; ⦁ знание программ пакета adobe; ⦁ знание php, mysql, wordpress, git будут преимуществом; ⦁ быстрая обучаемость; ⦁ структурное мышление; ⦁","наша компания инвестирует в собственные интернет-проекты, что даёт огромный простор для маневра и возможность воплощать в жизнь свои идеи. мы ищем устоявшегося html-верстальщика, у которого в портфолио уже есть проекты, которыми он гордится, кто готов развиваться и покорять новые вершины. ⦁ вёрстка страниц для сайтов на основе psd макетов (bootstrap); ⦁ вёрстка для адаптивных и мобильных решений; ⦁ выполнение правок на сайтах (по верстке, на wp); ⦁ оптимизация кода и графики; ⦁ самостоятельная «нарезка» графических элементов из растровых и векторных исходников; ⦁ хорошие знания html5, css3, js(jquery как минимум), less/sass; ⦁ использование инструментов для сборки; ⦁ интерес к разработке сайтов; ⦁ верстка должна быть кроссбраузерной, адаптивной, валидной и с высокой скоростью загрузки; ⦁ обязательно наличие портфолио; ⦁ знание программ пакета adobe; ⦁ знание php, mysql, wordpress, git будут преимуществом; ⦁ быстрая обучаемость; ⦁ структурное мышление; ⦁ 5 ссылок на ваши работы в сопроводительном письме. ⦁ никакого общения с клиентами; ⦁ своевременные выплаты; ⦁ гибкий график; ⦁ молодой коллектив, лишенный лишних формальностей; ⦁ возможность карьерного, профессионального, личностного роста.",html-верстальщикwp-разработчик(удаленно),Санкт-Петербург,30.0,90.0,Вайскод,2019-10-09T10:33:09+0300,between1And3,part,remote,PHP|jQuery|JavaScript|Git|CSS3|CSS|PHP5|HTML5|HTML|Jetbrains Phpstorm|Веб-программирование|CMS Wordpress|FTP|phpMyAdmin|СУБД|HTTP|Cистемы управления базами данных|SQL|Ajax
884,884,"- оформление, ведение, развитие официальной группы rockyroki вконтакте - ведение и развитие аккаунта rockyroki в instagram (выкладка постов и сторис 4-6 в день) - работа по существующему медиа плану + дополнения и проработка; - отложенный постинг + постинг по мере поступления актуальных новостей - организация и проведение конкурсов, опросов, акций в группах и сообществах; - таргетированная реклама - привлечение целевой аудитории, увеличение количества посетителей, подписчиков, участников групп и активности участников - мониторинг отзывов о компании, ответы на вопросы; - анализ эффективности рекламных кампаний, smm-продвижения; - подготовка аналитических отчетов по выполненной работе - написание тематических постов и работа с готовыми текстами - подготовка списка потенциальных партнеров по рекламе - проработка партнерских программ, - заключение договоров о взаимодействии в информационном пространстве с лидерами мнений и партнерскими организациями - верстка не сложных дизайн макетов - монтаж видеороликов",удаленная работа,опыт ведения соц. сетей от 1 года любовь к музыке портфолио работ по работе smm удаленная работа,"- оформление, ведение, развитие официальной группы rockyroki вконтакте - ведение и развитие аккаунта rockyroki в instagram (выкладка постов и сторис 4-6 в день) - работа по существующему медиа плану + дополнения и проработка; - отложенный постинг + постинг по мере поступления актуальных новостей - организация и проведение конкурсов, опросов, акций в группах и сообществах; - таргетированная реклама - привлечение целевой аудитории, увеличение количества посетителей, подписчиков, участников групп и активности участников - мониторинг отзывов о компании, ответы на вопросы; - анализ эффективности рекламных кампаний, smm-продвижения; - подготовка аналитических отчетов по выполненной работе - написание тематических постов и работа с готовыми текстами - подготовка списка потенциальных партнеров по рекламе - проработка партнерских программ, - заключение договоров о взаимодействии в информационном пространстве с лидерами мнений и партнерскими организациями - верстка не сложных дизайн макетов - монтаж видеороликов опыт ведения соц. сетей от 1 года любовь к музыке портфолио работ по работе smm удаленная работа",smmспециалист,Санкт-Петербург,,15000.0,Шихирина Вероника Юрьевна ,2019-10-08T20:08:17+0300,between1And3,part,fullDay,Adobe Photoshop|SMM|Продвижение бренда|Планирование рекламных кампаний|Реклама
563,563,• информационный обмен между офисами • анализ объемов информации • работа с электронной почтой • решение конфликтныx ситуаций • информационный обмен • ведение отчетности • ведение первичной документации (работа с накладными) • обработка данных и заполнения баз данных (excel) • информационный обмен с клиентами,• дружный‚ молодой коллектив • график работы: пятидневка с пн. по пт. с 9.00 до 13.00 или с 18.00 до 22.00. • зарплата = оклад + ежемесячная премия (до 20%) по результатам работы + оплата сверхурочных + выслуга лет • оформление в соответствии с тк рф (оплачиваемый ежегодный отпуск и больничный лист) • офис - центр города (10 минут пешком от ст. м. площадь восстания или лиговский пр-кт),"• высшее образование или неполное высшее (последний‚ предпоследний курс) • уверенный пользователь пк (office‚ excel, e-mail‚internet, outlook) • желательно высокая скорость печати • оперативность • пунктуальность • внимательность • ответственность • хорошие навыки общения • коммуникабельность • умение работать интенсивно • дружный‚ молодой коллектив • график работы: пятидневка с пн. по пт. с 9.00 до 13.00 или с 18.00 до 22.00. • зарплата = оклад + ежемесячная премия (до 20%) по результатам работы + оплата сверхурочных + выслуга лет • оформление в соответствии с тк рф (оплачиваемый ежегодный отпуск и больничный лист) • офис - центр города (10 минут пешком от ст. м. площадь восстания или лиговский пр-кт)","крупная российская логистическая компания «даймэкс», лидирующая на рынке экспресс-доставки корреспонденции и грузов по россии и всему миру, ведет поиск кандидата на должность «менеджер информационно-аналитического отдела» в г. санкт-петербург. • информационный обмен между офисами • анализ объемов информации • работа с электронной почтой • решение конфликтныx ситуаций • информационный обмен • ведение отчетности • ведение первичной документации (работа с накладными) • обработка данных и заполнения баз данных (excel) • информационный обмен с клиентами • ведение первичной документации (работа с накладными) • обработка данных и заполнения баз данных (excel. 1 c. карго) • высшее образование или неполное высшее (последний‚ предпоследний курс) • уверенный пользователь пк (office‚ excel, e-mail‚internet, outlook) • желательно высокая скорость печати • оперативность • пунктуальность • внимательность • ответственность • хорошие навыки общения • коммуникабельность • умение работать интенсивно • дружный‚ молодой коллектив • график работы: пятидневка с пн. по пт. с 9.00 до 13.00 или с 18.00 до 22.00. • зарплата = оклад + ежемесячная премия (до 20%) по результатам работы + оплата сверхурочных + выслуга лет • оформление в соответствии с тк рф (оплачиваемый ежегодный отпуск и больничный лист) • офис - центр города (10 минут пешком от ст. м. площадь восстания или лиговский пр-кт)",менеджеринформационно-аналитическогоотдела,Санкт-Петербург,12500.0,16000.0,DIMEX,2019-10-03T12:42:29+0300,noExperience,part,fullDay,
1372,1372,"1. устанавливает на серверы и рабочие станции операционные системы и необходимое для работы программное обеспечение. 2.осуществляет конфигурацию программного обеспечения на серверах и рабочих станциях. 3.поддерживает в работоспособном состоянии программное обеспечение серверов и рабочих станций. 4.регистрирует пользователей локальной сети и почтового сервера, назначает идентификаторы и пароли. 5.осуществляет техническую и программную поддержку пользователей, консультирует пользователей по вопросам работы локальной сети и программ, составляет инструкции по работе с программным обеспечением и доводит их до сведения пользователей. 6.устанавливает права доступа и контролирует использование сетевых ресурсов. 7.обеспечивает своевременное копирование, архивирование и резервирование данных. 8.принимает меры по восстановлению работоспособности локальной сети при сбоях или выходе из строя сетевого оборудования. 9.выявляет ошибки пользователей и программного обеспечения и принимает меры по их исправлению. 10.проводит мониторинг сети, разрабатывает предложения по развитию инфраструктуры сети. 11.обеспечивает сетевую безопасность (защиту от несанкционированного доступа к информации, просмотра или изменения системных файлов и данных), безопасность межсетевого взаимодействия. 12.осуществляет антивирусную защиту локальной вычислительной сети, серверов и рабочих станций. 13.готовит предложения по модернизации и приобретению сетевого оборудования. 14.осуществляет контроль за монтажом оборудования локальной сети специалистами сторонних организаций. 15.сообщает своему непосредственному руководителю о случаях нарушения правил пользования локальной вычислительной сетью и принятых мерах.",в соответствии с трудовым законодательством,"профильное профессиональное образование, опыт технического обслуживания и ремонта персональных компьютеров и оргтехники. в соответствии с трудовым законодательством","1. устанавливает на серверы и рабочие станции операционные системы и необходимое для работы программное обеспечение. 2.осуществляет конфигурацию программного обеспечения на серверах и рабочих станциях. 3.поддерживает в работоспособном состоянии программное обеспечение серверов и рабочих станций. 4.регистрирует пользователей локальной сети и почтового сервера, назначает идентификаторы и пароли. 5.осуществляет техническую и программную поддержку пользователей, консультирует пользователей по вопросам работы локальной сети и программ, составляет инструкции по работе с программным обеспечением и доводит их до сведения пользователей. 6.устанавливает права доступа и контролирует использование сетевых ресурсов. 7.обеспечивает своевременное копирование, архивирование и резервирование данных. 8.принимает меры по восстановлению работоспособности локальной сети при сбоях или выходе из строя сетевого оборудования. 9.выявляет ошибки пользователей и программного обеспечения и принимает меры по их исправлению. 10.проводит мониторинг сети, разрабатывает предложения по развитию инфраструктуры сети. 11.обеспечивает сетевую безопасность (защиту от несанкционированного доступа к информации, просмотра или изменения системных файлов и данных), безопасность межсетевого взаимодействия. 12.осуществляет антивирусную защиту локальной вычислительной сети, серверов и рабочих станций. 13.готовит предложения по модернизации и приобретению сетевого оборудования. 14.осуществляет контроль за монтажом оборудования локальной сети специалистами сторонних организаций. 15.сообщает своему непосредственному руководителю о случаях нарушения правил пользования локальной вычислительной сетью и принятых мерах. профильное профессиональное образование, опыт технического обслуживания и ремонта персональных компьютеров и оргтехники. в соответствии с трудовым законодательством",инженер-программист,Тюмень,20000.0,25000.0,Управление Роспотребнадзора по Тюменской области,2019-09-24T12:39:14+0300,between1And3,full,fullDay,Администрирование сетевого оборудования|Настройка сетевых подключений|Внутренний контроль|Cистемы управления базами данных|Настройка ПК|Настройка почтовых серверов|Техническое обслуживание|Выездное обслуживание
1129,1129,"обеспечение в работоспособном состоянии информационных систем (локальная сеть, сайт, телефония, офисная техника, доступ в интернет, программные продукты, серверы, система видеонаблюдения); сервисное обслуживание it-оборудования; ввод в эксплуатацию нового оборудования; настройка по;",работа в офисе с 9 до 18 5/2; стабильная выплата заработной платы;,практические знания семейства ос microsoft windows на уровне продвинутого пользователя; базовые знания аппаратного обеспечения; опыт ремонта пк на уровне блочного ремонта; дисциплинированность; коммуникабельность; способность планировать свою работу; ответственность; работа в офисе с 9 до 18 5/2; стабильная выплата заработной платы;,"в связи с расширением штата требуется it-специалист. обеспечение в работоспособном состоянии информационных систем (локальная сеть, сайт, телефония, офисная техника, доступ в интернет, программные продукты, серверы, система видеонаблюдения); сервисное обслуживание it-оборудования; ввод в эксплуатацию нового оборудования; настройка по; практические знания семейства ос microsoft windows на уровне продвинутого пользователя; базовые знания аппаратного обеспечения; опыт ремонта пк на уровне блочного ремонта; дисциплинированность; коммуникабельность; способность планировать свою работу; ответственность; работа в офисе с 9 до 18 5/2; стабильная выплата заработной платы;",it-специалист,Тюмень,22000.0,25000.0,IT-Группа СВОИ,2019-09-20T12:05:36+0300,between1And3,full,fullDay,Системы видеонаблюдения|Ремонт ПК|Настройка сетевых подключений|Проектирование ЛВС|Мини-АТС|DHCP|Настройка DNS|Настройка ПК|Сборка ПК|Настройка ПО|Техническое обслуживание|Офисная техника|TCP/IP
