,Unnamed: 0,responsibility,conditions,requirement,description,name,city,salary_from,salary_to,employer,published_at,experience,employment,schedule,key_skills
467,467,"удаленная поддержка пользователей, выезды на объекты пользователей, поддержание в работоспособном состоянии оборудования и по пользователей, участие в проектах по внедрению систем автоматизации","характер работы выездной так и на территории офиса организация расположена в трех минутах от ст.м. московская. проезд и мобильная связь оплачивается дружный сплоченный коллектив подробности и все интересующие вопросы обсуждается на собеседовании (заработная плата, правила оформления и т.д.)","высшее образование в области ит, приборостроения или телекоммуникаций (не оконченное) знание ос windows на уровне уверенного пользователя базовые навыки установки и настройки сетевого оборудования, начального уровня коммуникабельность, ответственность, доброжелательность, опрятный внешний вид , умение вести деловую переписку, стрессоустойчивость, устойчивое желание обучаться, совершенствоваться и повышать свои навыки. характер работы выездной так и на территории офиса организация расположена в трех минутах от ст.м. московская. проезд и мобильная связь оплачивается дружный сплоченный коллектив подробности и все интересующие вопросы обсуждается на собеседовании (заработная плата, правила оформления и т.д.)","компания практик автоматизация ресторанов, кафе, баров tillypadxl. системная интеграция пп для предприятий сегмента horeca. удаленная поддержка пользователей, выезды на объекты пользователей, поддержание в работоспособном состоянии оборудования и по пользователей, участие в проектах по внедрению систем автоматизации высшее образование в области ит, приборостроения или телекоммуникаций (не оконченное) знание ос windows на уровне уверенного пользователя базовые навыки установки и настройки сетевого оборудования, начального уровня коммуникабельность, ответственность, доброжелательность, опрятный внешний вид , умение вести деловую переписку, стрессоустойчивость, устойчивое желание обучаться, совершенствоваться и повышать свои навыки. характер работы выездной так и на территории офиса организация расположена в трех минутах от ст.м. московская. проезд и мобильная связь оплачивается дружный сплоченный коллектив подробности и все интересующие вопросы обсуждается на собеседовании (заработная плата, правила оформления и т.д.)",системныйадминистратор,Санкт-Петербург,17000.0,35000.0,Практик,2019-09-17T11:29:05+0300,noExperience,full,fullDay,
476,476,,,,"работа подходит для студентов без опыта и специалистов в начале своего карьерного пути. мы ищем усидчивых сотрудников, внимательных к деталям и стремящихся к саморазвитию в дружном коллективе. что делаем: заполнение анкет в web-форме по полученным данным участие в формировании гайдов для новых сотрудников помощь в оптимизации процессов что ждем от кандидата: ответственность, пунктуальность уверенное владение пк знание иностранных языков будет преимуществом что мы предлагаем: гибкий график работы для совмещения с учебой, работа в офисе стабильная заработная плата официальное трудоустройство возможность карьерного роста работа в центре санкт-петербурга, в минуте от метро офис с собственной кухней и живым уголком",модератор,Санкт-Петербург,25000.0,35000.0,Скпд,2019-09-12T23:51:34+0300,noExperience,project,shift,Уверенное владение компьютером|Пользователь ПК|Поиск информации в интернет
1173,1173,монтаж линий связи электромонтаж,оформление согласно тк рф испытательный срок 2 месяца своевременная выплата з/п спецодежда и инструмент за счет компании,опыт работы от 1 года желание работать оформление согласно тк рф испытательный срок 2 месяца своевременная выплата з/п спецодежда и инструмент за счет компании,монтаж линий связи электромонтаж опыт работы от 1 года желание работать оформление согласно тк рф испытательный срок 2 месяца своевременная выплата з/п спецодежда и инструмент за счет компании,монтажникслаботочныхсистем,Тюмень,25000.0,35000.0,Стриж Т,2019-09-24T10:58:37+0300,between1And3,full,fullDay,
111,111,удаленная диагностика и решение проблем корпоративных клиентов с доступом к сети интернет; консультирование по техническим вопросам; удалённая настройка оборудования;,"оформление согласно тк рф; белая заработная плата; график работы: 2/2 9-21; мы готовы рассмотреть кандидатов без опыта работы, но с большим желанием развиваться в сфере сетевых технологий; реальная возможность расти и развиваться профессионально; уютный офис в центре города, чай и кофе за счет компании.",,"удаленная диагностика и решение проблем корпоративных клиентов с доступом к сети интернет; консультирование по техническим вопросам; удалённая настройка оборудования; что ждем от кандидата: знание основ tcp/ip, сетевых протоколов: ip, arp, dhcp, dns, telnet, ssh, tcp, udp, sip; понимание построения локальной сети; представление об уровнях модели osi; базовые представления о процессах коммутации и маршрутизации; опыт настройки подключения к сети интернет различных устройств: роутера, компьютера и т.д. стрессоустойчивость, обучаемость, коммуникабельность, грамотная устная речь. оформление согласно тк рф; белая заработная плата; график работы: 2/2 9-21; мы готовы рассмотреть кандидатов без опыта работы, но с большим желанием развиваться в сфере сетевых технологий; реальная возможность расти и развиваться профессионально; уютный офис в центре города, чай и кофе за счет компании.",специалисттехническойподдержкиинженергсктв(b2bсегмент),Санкт-Петербург,30000.0,35000.0,ЭР-Телеком,2019-10-07T10:07:44+0300,noExperience,full,shift,
196,196,подтверждение заказов интернет-магазина по телефону обработка входящих обращений работа с электронной почтой выдача заказов со склада,"график 2/2 с 09:00 до 21:00 по будням с 10:00 до 20:00 по выходным работа на северном пр (метро академическая, гражданский проспект)","грамотная устная и письменная речь собранность, организованность. график 2/2 с 09:00 до 21:00 по будням с 10:00 до 20:00 по выходным работа на северном пр (метро академическая, гражданский проспект)","интернет магазин для кондитеров ищет в команду менеджера интернет магазина. звоните по вакансии! подтверждение заказов интернет-магазина по телефону обработка входящих обращений работа с электронной почтой выдача заказов со склада грамотная устная и письменная речь собранность, организованность. график 2/2 с 09:00 до 21:00 по будням с 10:00 до 20:00 по выходным работа на северном пр (метро академическая, гражданский проспект)",менеджеринтернет-магазина,Санкт-Петербург,30000.0,35000.0,ЭД Девелоп,2019-10-09T13:58:07+0300,noExperience,full,fullDay,оформление заказов|входящие звонки|исходящие звонки|работа с физическими лицами|Консультирование клиентов по телефону
726,726,,,,"активно развивающаяся сеть мастерских и магазинов. основное направление: продажа и ремонт детских колясок, гироскутеров, самокатов. приглашаем специалиста для работы с клиентами и интернет заказами. обязанности: —подтверждение интернет заказов; —прием входящих звонков; —консультация по ассортименту интернет-магазина требования: —опыт работы в колл-центре; —знание пк на уровне уверенного пользователя; —внимательность, вежливость, знание телефонного этикета; —грамотная речь, поставленная дикция; стрессоустойчивость; высокая скорость печати. условия: —график работы 5/2 день (09:00-18:00)-выходные плавающие; —наш офис располагается в 5 мин от метро парк победы.",специалистколл-центра,Санкт-Петербург,30000.0,35000.0,Кузьмин Сергей Николаевич,2019-10-08T12:39:48+0300,between1And3,full,fullDay,Консультирование клиентов по телефону|оформление заказов|Ведение клиентской базы|Консультирование клиентов|Пользователь ПК
974,974,"поддержка клиентов по техническим вопросом (телефон, почта) проверка работоспособности объектов охраны; программирование и активация систем охраны; дистанционное устранение неисправностей оборудования.",оформление по тк рф; комфортный офис в пешей доступности от станции метро &quot;звездная&quot;; обучение на время стажировки; сменный график работы 2/2. присоединяйтесь! мы по достоинству оценим ваш профессионализм!,"умение общаться грамотно по телефону с клиентами; желательно техническое образование; быть уверенным пользователем пк; грамотная речь, внимательность, стрессоустойчивость. вашим преимуществом будет: знание axapta; опыт работы с базами данных. оформление по тк рф; комфортный офис в пешей доступности от станции метро &quot;звездная&quot;; обучение на время стажировки; сменный график работы 2/2. присоединяйтесь! мы по достоинству оценим ваш профессионализм!","&quot;цезарь сателлит&quot; – ведущий оператор услуг пультовой охраны на федеральном уровне. &quot;цезарь сателлит&quot; — это стабильная, динамично - развивающаяся компания, лидер в области обеспечении безопасности личного и коммерческого автотранспорта, охрана и мониторинг объектов недвижимости. мы приглашаем в нашу команду &quot;технического специалиста центра поддержки&quot;: поддержка клиентов по техническим вопросом (телефон, почта) проверка работоспособности объектов охраны; программирование и активация систем охраны; дистанционное устранение неисправностей оборудования. умение общаться грамотно по телефону с клиентами; желательно техническое образование; быть уверенным пользователем пк; грамотная речь, внимательность, стрессоустойчивость. вашим преимуществом будет: знание axapta; опыт работы с базами данных. оформление по тк рф; комфортный офис в пешей доступности от станции метро &quot;звездная&quot;; обучение на время стажировки; сменный график работы 2/2. присоединяйтесь! мы по достоинству оценим ваш профессионализм!",ведущийспециалисттехническойподдержки,Санкт-Петербург,30000.0,35000.0,Цезарь Сателлит Северо-Запад,2019-10-09T10:31:19+0300,noExperience,full,shift,Консультирование клиентов|Ведение отчетности|Техническая поддержка|Пользователь ПК|Грамотная речь|Грамотность
1043,1043,"консультация и техническая поддержка пользователей; установка и настройка программного обеспечения и операционных систем; поддержка в рабочем состоянии локальной сети, компьютеров и оргтехники;",работа в стабильной иностранной компании график работы с 9 до 18 дмс,"образование не ниже среднего профессионального; знание и опыт настройки oc windows 7/8/10, сетевого оборудования, оргтехники поддержка в рабочем состоянии локальной сети, компьютеров и оргтехники; работа в стабильной иностранной компании график работы с 9 до 18 дмс","консультация и техническая поддержка пользователей; установка и настройка программного обеспечения и операционных систем; поддержка в рабочем состоянии локальной сети, компьютеров и оргтехники; образование не ниже среднего профессионального; знание и опыт настройки oc windows 7/8/10, сетевого оборудования, оргтехники поддержка в рабочем состоянии локальной сети, компьютеров и оргтехники; работа в стабильной иностранной компании график работы с 9 до 18 дмс",помощниксистемногоадминистратора,Санкт-Петербург,30000.0,35000.0,Каверион Элмек,2019-09-17T16:43:26+0300,between1And3,full,fullDay,Настройка сетевых подключений|Настройка ПК|Windows 7|Настройка ПО|Администрирование сетевого оборудования
1134,1134,"администрирование ос windows xp, 7, 8, 10 администрирование ос windows server 2008, 2012, 2016 настройка сетевого оборудования: wifi, router, hub настройка подключений по локальной сети настройка vpn сети по протоколу pptp или l2tp настройка электронной почты установка и настройка офисных программ диагностика и устранение неисправностей персональных компьютеров планирование ремонтов и замен персональных компьютеров обслуживание копировальной техники обслуживание программного комплекса топаз для азс",полный рабочий день работа в офисе или на выезде,"опыт установки и настройки ос windows xp, 7, 8, 10 опыт установки и настройки ос windows server 2008, 2012, 2016 знание основ построения лвс опыт настройки локальной сети и сетевого оборудования опыт настройки сетей vpn опыт по диагностике и устранению неисправностей персональных компьютеров опыт обслуживания программы топаз азс и топаз офис коммуникабельность полный рабочий день работа в офисе или на выезде","администрирование ос windows xp, 7, 8, 10 администрирование ос windows server 2008, 2012, 2016 настройка сетевого оборудования: wifi, router, hub настройка подключений по локальной сети настройка vpn сети по протоколу pptp или l2tp настройка электронной почты установка и настройка офисных программ диагностика и устранение неисправностей персональных компьютеров планирование ремонтов и замен персональных компьютеров обслуживание копировальной техники обслуживание программного комплекса топаз для азс опыт установки и настройки ос windows xp, 7, 8, 10 опыт установки и настройки ос windows server 2008, 2012, 2016 знание основ построения лвс опыт настройки локальной сети и сетевого оборудования опыт настройки сетей vpn опыт по диагностике и устранению неисправностей персональных компьютеров опыт обслуживания программы топаз азс и топаз офис коммуникабельность полный рабочий день работа в офисе или на выезде",ведущийсистемныйадминистратор,Тюмень,30000.0,35000.0,Линком,2019-10-04T11:07:59+0300,between3And6,full,fullDay,Настройка сетевых подключений|Ремонт ПК|Настройка ПО|Wifi networks|Администрирование сетевого оборудования
