,Unnamed: 0,responsibility,conditions,requirement,description,name,city,salary_from,salary_to,employer,published_at,experience,employment,schedule,key_skills
1243,1243,,,,"кто мы: - it-компания, предоставляющая облачные решения в сфере такси. к нашим сервисам подключено большое количество компаний, среди которых как мелкие региональные игроки, так и компании с мировым именем, с сотнями городов и десятками стран присутствия. что у нас есть: - сложный высоконагруженный сервис с миллионами пользователей по всему миру и более 12 миллионов установок в google play. мы хотим найти человека, который: - знает ооп и структуры данных, понимает принципы solid; - имеет опыт разработки на java или kotlin для android; - знает android sdk, понимает архитектуру android; - имеет опыт работы с android studio, gradle; - знаком с принципами material design; - имеет опыт работы с системами контроля версий git; - работал с sql базами данных; будем большим плюсом, если: - есть опубликованные android-приложения (google play); - есть опыт коммерческой разработки под android. что мы предлагаем: - множество интересных задач, в решении которых вы можете принять полноправное участие; - дружелюбный коллектив профессионалов; - корпоративное обучение; - поездки на it-конференции; - комфортное рабочее место; - компенсацию питания; - бесплатные корпоративные мероприятия (новый год, командные выезды и движухи); - уровень заработной платы, который зависит от технических знаний и навыков (регулярные пересмотры при повышении результатов и качества работы).",androidразработчик,Тюмень,50000.0,200000.0,Сервис заказа такси Максим,2019-10-07T14:28:48+0300,between1And3,full,fullDay,
1260,1260,,,,"кто мы: - it-компания, предоставляющая облачные решения в сфере такси. к нашим сервисам подключено большое количество компаний, среди которых как мелкие региональные игроки, так и компании с мировым именем, с сотнями городов и десятками стран присутствия. что у нас есть: - сложный высоконагруженный сервис с миллионами пользователей по всему миру и более 7 миллионов установок в app store. мы хотим найти человека, который: - знает ооп и шаблоны проектирования, понимает принципы solid; - знает ios sdk (uikit, foundation, coregraphics, corelocation и др.); - хорошо понимает клиент-серверные модели взаимодействия приложений; - знает основные сетевые технологии; - понимает multithreading/gcd/nsoperationqueue; - отлично знает interface builder, storyboard, autolayout; - имеет опыт работы с системами контроля версий git; будем большим плюсом, если: - есть опыт коммерческой разработки на objective-c (swift будем плюсом) для ios; - есть опубликованные ios-приложения (appstore). что мы предлагаем: - множество интересных задач, в решении которых вы можете принять полноправное участие; - дружелюбный коллектив профессионалов; - корпоративное обучение; - поездки на it-конференции; - комфортное рабочее место; - компенсацию питания; - бесплатные корпоративные мероприятия (новый год, командные выезды и движухи); - уровень заработной платы, который зависит от технических знаний и навыков (регулярные пересмотры при повышении результатов и качества работы).",iosразработчик,Тюмень,50000.0,200000.0,Сервис заказа такси Максим,2019-10-07T14:28:48+0300,between1And3,full,fullDay,
28,28,,,,"группа компаний &quot;медиасфера&quot; - это 6 компаний, одна из крупнейших групп компаний в сзфо, существуем с 1997 года - более 20 лет. мы входим в топ - 3 рейтинга рунета по сзфо по всем направлениям интернет маркетинга и в золотую сотню российского digital. мы являемся постоянными участниками координационного совета сообщества specia. группа компаний &quot;медиасфера&quot; ищет руководителя отдела продаж с перспективой стать совладельцем в компанию &quot;фабрика сайтов&quot;, одного из основных игроков на рынке веб-услуг в сегменте смб (более 9000 созданных сайтов с 1999 года). какие задачи будут стоять перед тобой? выполнение плана продаж и достижение целевых показателей отдела; планирование и организация работы отдела продаж; составление плана развития сотрудников и регулярное обучение; работа над улучшением клиентского сервиса; найм, обучение и адаптация новых сотрудников; участие в разработке рекламных кампаний, акций, скидок и т.д.; формирование необходимой отчетности. что мы от тебя ждем? успешный опыт управления отделом/группой продаж в it от 2 лет; успешный опыт личных продаж; способность ставить амбициозные цели в продажах и достигать их; развитые коммуникативные и управленческие навыки; опыт работы с crm, системами аналитики продаж; умение сплотить и увлечь команду; позитивный настрой в работе, без этого никуда. что мы предлагаем? сложные и интересные задачи; возможность влиять на развитие компании; достойная оплата труда; возможность участия в прибыли компании; возможность стать совладельцем компании; гибкое начало рабочего дня с 9:00 – 10:00; офис в двух минутах от метро пролетарская.",руководительотделапродаж,Санкт-Петербург,90000.0,200000.0,Фабрика сайтов,2019-10-10T15:22:55+0300,between1And3,full,fullDay,
18,18,,,,"кто мы: компания simpleone, входящая в группу компаний itglobal. занимаемся разработкой платформы для автоматизации всех сервисных бизнес-процессов клиентов. ориентируемся на средних и крупных корпоративных и государственных заказчиков, занимающихся цифровой трансформацией. продукт имеет конкурентные преимущества в виде сочетания лучшего пользовательского опыта и дизайна (ui/ux), высокой производительности (performance) и наличия low-code инструментария, позволяющего существенно сокращать сроки внедрения. продукт комплексный, сложный и интересный. потенциальный лидер рынка. цель проекта - стать лидером в сегменте диджитализации бизнеса на рынке в россии и значимым игроком на мировом рынке. в наши планы входит получение статуса резидента сколково и войти в реестр отечественного программного обеспечения (программа импортозамещения). имеем планы выхода на международные рынки: снг, турция, ближний восток, оаэ, европа. мы верим в то, что лучшие продукты делаются лучшими специалистами, поэтому мы ищем профессионалов с большой буквы с опытом применения прогрессивных технологий, разработки крупных высоконагруженных систем. при этом активно способствуем саморазвитию своих сотрудников, обязуем регулярно выделять время на изучение новых технологий и обеспечиваем обучение. в связи с расширением в команду разработки ищем senior react developer/ведущий react разработчик. рассматриваем кандидатов в том числе из других регионов и готовы помочь с переездом. что для нас важно: опыт коммерческого программирования от 4 лет опыт js от 3 лет опыт jquery или аналога от 3 лет опыт react от 2 лет также будет хорошо, если у вас есть: если вы вы также уверены во backend, как fronend; у вас есть опыт в роли teamlead*; собственные проекты (проекты для себя); собственные опубликованные плагины; ведение блога; что вы получите от компании: работу в стабильной и динамично развивающейся it-компании, лидирующей на рынке облачных технологий; полностью официальное оформление по тк рф, с полностью белой заработной платой и отпуском 28 дней; бонусы и премии по результатам работы; конкурентный уровень заработной платы, который мы готовы обсудить на собеседовании; график работы – стандартный, но с гибким подходом; высокопрофессиональную, молодую и дружную команду ит-специалистов, увлеченных своим делом; профессиональный рост и развитие вместе с проектами компании; своя оборудованная столовая, столовая на территории бизнес-центра; корпоративные мероприятия; обучение за счет компании, в то числе и профессиональная сертификация; современный офис: в санкт-петербурге в бизнес-центре класса а &quot;преображенский двор&quot; или в технопарке &quot;ит-крым&quot; г. севастополь (возле тц муссон, здание &quot;одеколон&quot;) возможно работать в санкт-петербурге, севастополе, а так же удаленно. программа ре локации для тех кто хочет переехать в севастополь.",seniorreactdeveloperведущийreactразработчик,Санкт-Петербург,120000.0,200000.0,ITGLOBAL.COM,2019-10-07T10:14:03+0300,between3And6,full,remote,
1359,1359,,,,"если вы - успешный специалист в области продаж, со свободным разговорным английским, вам интересно развиваться в направлении продаж образовательных услуг физическим лицам и компаниям нефтегазового сектора за рубежом, то мы приглашаем вас в команду международного института дополнительного образования. международный институт дополнительного образования (мидо) c 2016 года является лидером в сегменте дополнительного профессионального образования в нефтегазовой отрасли. нам доверяют обучение своих сотрудников такие топ-компании, как газпром, роснефть, лукойл, baker hughes, schlumberger и другие лидеры отрасли. в портфеле образовательных услуг мидо представлены, в том числе, программы международного уровня, документ о прохождении которых востребован нефтегазовыми компаниями во всем мире. поэтому, стратегией развития компании запланирован выход на международный рынок образовательных услуг и для старта проекта нам нужен амбициозный, результативный менеджер по продажам на международном рынке . работая с нами вы получите: достойный уровень оплаты труда, неограниченный потолок дохода и возможность напрямую на него влиять, гибкую политику управления, свободу в реализации вашего потенциала, интересные проекты и опыт работы с топ-компаниями на международном рынке добычи нефти и газа, возможность удаленной работы (home-office). территориально вы можете находиться в любом городе! вашими ключевыми задачами будет: поиск и развитие каналов продаж международных образовательных программ за рубежом, поиск возможных партнеров по продвижению услуг, провайдеров обучения, проведение деловых переговоров и деловая переписка с юридическими и физическими лицами, продажа образовательных услуг. мы ожидаем от вас: опыт работы в продажах (b2b и/или b2c), понимание этапов продаж и ключевых факторов эффективности каждого этапа, опыт устных и письменных деловых коммуникаций (проведения переговоров, составление коммерческих предложений, деловая переписка), в том числе знание международного делового этикета и культурных особенностей, английский язык на уровне advanced (с1), опыт управления проектами будет плюсом, самостоятельность, инициативность и нацеленность на результат - готовых схем работы не будет! порядочность и ответственность - мы готовы доверить вам самостоятельную организацию деятельности и надеемся на взаимную ответственность, клиенториентированность, умение и желание построить долгосрочные отношения с клиентами, любовь к продажам, готовность непрерывно развивать свои навыки. если вы готовы к вызовам и амбициозным задачам, решение которых будет непосредственно влиять на ваш доход, мы будем рады рассказать вам подробнее о компании и вакансии (по итогам предварительного рассмотрения резюме).",менеджерпопродажамнамеждународномрынке,Тюмень,120000.0,200000.0,Международный институт дополнительного образования,2019-10-10T07:41:31+0300,moreThan6,full,remote,B2B Продажи|Активные продажи|Управление продажами|Ведение переговоров|Холодные продажи|Развитие продаж|Управление проектами|B2C продажи|Деловая переписка|Зарубежные поисковые системы|Ведение переписки на иностранном языке|Навыки продаж|Развитие ключевых клиентов|Холодные звонки
541,541,,,,"we are looking for an enthusiastic and experienced senior node.js/angular full stack developer who is focused on quality. required skills: - 3+ years of experience in commercial software development; - experience developing rest apis - 1+ years of experience with nodejs/express; - experience with nosql, preferably mongodb; - knowledge of html/css3 - knowledge of angular 4+ - understanding micro services and serverless architectures - analytical thinking skills - git (basic commands, branching, merging) - fluent english (will speak with american stakeholders) as a plus: - experience unit tests - in-depth knowledge of database design and optimization; - experience with aws, heroku would be an advantage. responsibilities: - development and support of a web app and chrome extension from specifying requirements till production; - web front-end and back-end (node.js) development; - project integration with multiple internal/external systems; - participation in production incidents resolution.",nodejsangularfull-stackseniordeveloper,Санкт-Петербург,150000.0,200000.0,Корсун Алексей Сергеевич,2019-10-08T09:38:44+0300,between3And6,full,flexible,Node.js|MongoDB|AngularJS|JavaScript|CSS3
1314,1314,,,,"тензор– крупная российская it-компания. наш основной продукт – сбис – сеть деловых коммуникаций. сбис объединяет людей и компании, системы управления и учета, бизнес-процессы и документы в одной системе. систему сбис придумали, создали и постоянно совершенствуют почти 1500 разработчиков в 11 центрах разработки по стране. у нас есть фанаты дата-майнинга, эксперты в разработке кроссплатформенных приложений и высоконагруженных систем, разработчики мобильных, настольных и веб-приложений, специалисты по обработке, анализу и хранению больших массивов данных. мы ищем людей, способных реализовывать крупные проекты от идеи до “продакшна”. присоединившись к нашей команде, у вас будет возможность усовершенствовать систему сбис. результатом вашей работы будут пользоваться более миллиона людей – на компьютерах, планшетах и смартфонах. мы не работаем под заказ, мы создаем тиражные продукты. используемый стек технологий: c++, python, postgresql, javascript, typescript, nodejs, redis, elasticsearch, clickhouse. вам не нужно знать буквально все наши технологии. нужна светлая голова и страстное желание работать. делать лучший продукт в россии. мы ждем от вас: опыт коммерческой разработки; опыт и желание руководить группой; готовность экспериментировать и изучать новое; отличные знания javascript, опыт работы с фрэймворками; умение читать чужой код; желание и умение писать красивый, структурированный, системный код. вам предстоит заниматься: разработкой архитектурных решений; организацией рабочих процессов внутри команды, распределением задач и ролей; взаимодействием со смежными командами; ревью кода, менторство; обсуждением с проект-менеджером задач бизнеса; контролем выполнения задач своего отдела и смежных. мы предлагаем: заработная плата в зависимости от квалификации и уровня ответственности; оформление по тк рф; премии от 5 до 20% по итогам работы за месяц; социальные гарантии; дмс после года работы в компании; курсы английского языка; спортивные программы; корпоративные праздники и различные совместные мероприятия.",teamleadруководительгруппы(javascript),Тюмень,146000.0,230000.0,Тензор,2019-09-30T09:57:31+0300,between3And6,full,fullDay,JavaScript|HTML|CSS|Управление проектами
